{
  "$schema": "../schemas/canonical_data_dictionary.schema.json",
  "schema_version": 1,
  "dictionary_id": "us_fundamentals_release_1_metrics",
  "dictionary_version": "1.0.0",
  "release": "1",
  "status": "frozen",
  "description": "Canonical reported and derived accounting metrics for Release 1 ordinary domestic U.S.-GAAP operating companies.",
  "value_convention": "reported_value_preserved",
  "metrics": [
    {
      "metric_id": "cash_and_equivalents",
      "name": "Cash And Equivalents",
      "metric_kind": "reported",
      "definition": "Cash and demand deposits available for immediate use, including qualifying cash equivalents.",
      "statement": "balance_sheet",
      "period_type": "instant",
      "unit": "monetary",
      "polarity": "debit",
      "dimensional_scope": "consolidated",
      "industry_applicability": [
        "all_release_1"
      ],
      "industry_exclusions": [],
      "materiality_tier": "core",
      "formula": null,
      "fallback_rules": [
        "Use the highest-priority approved direct fact with compatible period, unit, statement role, and dimensions.",
        "If no compatible direct fact exists, publish no observation; do not reconstruct or impute this metric."
      ],
      "version_added": "1.0.0"
    },
    {
      "metric_id": "restricted_cash",
      "name": "Restricted Cash",
      "metric_kind": "reported",
      "definition": "Cash whose withdrawal or use is contractually or legally restricted.",
      "statement": "balance_sheet",
      "period_type": "instant",
      "unit": "monetary",
      "polarity": "debit",
      "dimensional_scope": "consolidated",
      "industry_applicability": [
        "all_release_1"
      ],
      "industry_exclusions": [],
      "materiality_tier": "standard",
      "formula": null,
      "fallback_rules": [
        "Use the highest-priority approved direct fact with compatible period, unit, statement role, and dimensions.",
        "If no compatible direct fact exists, publish no observation; do not reconstruct or impute this metric."
      ],
      "version_added": "1.0.0"
    },
    {
      "metric_id": "short_term_investments",
      "name": "Short Term Investments",
      "metric_kind": "reported",
      "definition": "Marketable investments expected to be realized within the operating cycle or one year.",
      "statement": "balance_sheet",
      "period_type": "instant",
      "unit": "monetary",
      "polarity": "debit",
      "dimensional_scope": "consolidated",
      "industry_applicability": [
        "all_release_1"
      ],
      "industry_exclusions": [],
      "materiality_tier": "core",
      "formula": null,
      "fallback_rules": [
        "Use the highest-priority approved direct fact with compatible period, unit, statement role, and dimensions.",
        "If no compatible direct fact exists, publish no observation; do not reconstruct or impute this metric."
      ],
      "version_added": "1.0.0"
    },
    {
      "metric_id": "accounts_receivable",
      "name": "Accounts Receivable",
      "metric_kind": "reported",
      "definition": "Trade and other accounts receivable, net of reported allowances.",
      "statement": "balance_sheet",
      "period_type": "instant",
      "unit": "monetary",
      "polarity": "debit",
      "dimensional_scope": "consolidated",
      "industry_applicability": [
        "all_release_1"
      ],
      "industry_exclusions": [],
      "materiality_tier": "core",
      "formula": null,
      "fallback_rules": [
        "Use the highest-priority approved direct fact with compatible period, unit, statement role, and dimensions.",
        "If no compatible direct fact exists, publish no observation; do not reconstruct or impute this metric."
      ],
      "version_added": "1.0.0"
    },
    {
      "metric_id": "allowance_for_doubtful_accounts",
      "name": "Allowance For Doubtful Accounts",
      "metric_kind": "reported",
      "definition": "Contra-asset allowance for expected uncollectible receivables.",
      "statement": "balance_sheet",
      "period_type": "instant",
      "unit": "monetary",
      "polarity": "credit",
      "dimensional_scope": "consolidated",
      "industry_applicability": [
        "all_release_1"
      ],
      "industry_exclusions": [],
      "materiality_tier": "supplemental",
      "formula": null,
      "fallback_rules": [
        "Use the highest-priority approved direct fact with compatible period, unit, statement role, and dimensions.",
        "If no compatible direct fact exists, publish no observation; do not reconstruct or impute this metric."
      ],
      "version_added": "1.0.0"
    },
    {
      "metric_id": "inventory",
      "name": "Inventory",
      "metric_kind": "reported",
      "definition": "Inventories held for sale, production, or consumption in production.",
      "statement": "balance_sheet",
      "period_type": "instant",
      "unit": "monetary",
      "polarity": "debit",
      "dimensional_scope": "consolidated",
      "industry_applicability": [
        "all_release_1"
      ],
      "industry_exclusions": [],
      "materiality_tier": "core",
      "formula": null,
      "fallback_rules": [
        "Use the highest-priority approved direct fact with compatible period, unit, statement role, and dimensions.",
        "If no compatible direct fact exists, publish no observation; do not reconstruct or impute this metric."
      ],
      "version_added": "1.0.0"
    },
    {
      "metric_id": "prepaid_expenses",
      "name": "Prepaid Expenses",
      "metric_kind": "reported",
      "definition": "Current-period cash payments recognized as expense in a future period.",
      "statement": "balance_sheet",
      "period_type": "instant",
      "unit": "monetary",
      "polarity": "debit",
      "dimensional_scope": "consolidated",
      "industry_applicability": [
        "all_release_1"
      ],
      "industry_exclusions": [],
      "materiality_tier": "standard",
      "formula": null,
      "fallback_rules": [
        "Use the highest-priority approved direct fact with compatible period, unit, statement role, and dimensions.",
        "If no compatible direct fact exists, publish no observation; do not reconstruct or impute this metric."
      ],
      "version_added": "1.0.0"
    },
    {
      "metric_id": "other_current_assets",
      "name": "Other Current Assets",
      "metric_kind": "reported",
      "definition": "Current assets not represented by another canonical current-asset metric.",
      "statement": "balance_sheet",
      "period_type": "instant",
      "unit": "monetary",
      "polarity": "debit",
      "dimensional_scope": "consolidated",
      "industry_applicability": [
        "all_release_1"
      ],
      "industry_exclusions": [],
      "materiality_tier": "standard",
      "formula": null,
      "fallback_rules": [
        "Use the highest-priority approved direct fact with compatible period, unit, statement role, and dimensions.",
        "If no compatible direct fact exists, publish no observation; do not reconstruct or impute this metric."
      ],
      "version_added": "1.0.0"
    },
    {
      "metric_id": "current_assets",
      "name": "Current Assets",
      "metric_kind": "reported",
      "definition": "Total assets expected to be realized, sold, or consumed within the operating cycle or one year.",
      "statement": "balance_sheet",
      "period_type": "instant",
      "unit": "monetary",
      "polarity": "debit",
      "dimensional_scope": "consolidated",
      "industry_applicability": [
        "all_release_1"
      ],
      "industry_exclusions": [],
      "materiality_tier": "core",
      "formula": null,
      "fallback_rules": [
        "Use the highest-priority approved direct fact with compatible period, unit, statement role, and dimensions.",
        "If no compatible direct fact exists, publish no observation; do not reconstruct or impute this metric."
      ],
      "version_added": "1.0.0"
    },
    {
      "metric_id": "property_plant_equipment_gross",
      "name": "Property Plant Equipment Gross",
      "metric_kind": "reported",
      "definition": "Property, plant, and equipment before accumulated depreciation and impairment.",
      "statement": "balance_sheet",
      "period_type": "instant",
      "unit": "monetary",
      "polarity": "debit",
      "dimensional_scope": "consolidated",
      "industry_applicability": [
        "all_release_1"
      ],
      "industry_exclusions": [],
      "materiality_tier": "standard",
      "formula": null,
      "fallback_rules": [
        "Use the highest-priority approved direct fact with compatible period, unit, statement role, and dimensions.",
        "If no compatible direct fact exists, publish no observation; do not reconstruct or impute this metric."
      ],
      "version_added": "1.0.0"
    },
    {
      "metric_id": "accumulated_depreciation",
      "name": "Accumulated Depreciation",
      "metric_kind": "reported",
      "definition": "Cumulative depreciation and impairment recognized against property, plant, and equipment.",
      "statement": "balance_sheet",
      "period_type": "instant",
      "unit": "monetary",
      "polarity": "credit",
      "dimensional_scope": "consolidated",
      "industry_applicability": [
        "all_release_1"
      ],
      "industry_exclusions": [],
      "materiality_tier": "standard",
      "formula": null,
      "fallback_rules": [
        "Use the highest-priority approved direct fact with compatible period, unit, statement role, and dimensions.",
        "If no compatible direct fact exists, publish no observation; do not reconstruct or impute this metric."
      ],
      "version_added": "1.0.0"
    },
    {
      "metric_id": "property_plant_equipment_net",
      "name": "Property Plant Equipment Net",
      "metric_kind": "reported",
      "definition": "Property, plant, and equipment after accumulated depreciation and impairment.",